{
  "$schema": "https://json-schema.org/draft/2020-12/schema",
  "$id": "edition.schema.json",
  "title": "Rupert Atlas edition",
  "description": "One of two independent choices (Tuesday, Thursday) for the same coming weekend.",
  "type": "object",
  "additionalProperties": false,
  "required": [
    "schema_version",
    "id",
    "slot",
    "status",
    "published_at",
    "weekend",
    "flagship",
    "local_trail",
    "away_mission",
    "wildcard",
    "mission",
    "memory_prompt",
    "conditions",
    "practical"
  ],
  "properties": {
    "schema_version": {
      "const": 1
    },
    "id": {
      "type": "string",
      "pattern": "^\\d{4}-W\\d{2}-(?:r\\d+-)?(tue|thu)$"
    },
    "slot": {
      "enum": [
        "tuesday",
        "thursday"
      ]
    },
    "status": {
      "enum": [
        "draft",
        "published",
        "withdrawn"
      ]
    },
    "published_at": {
      "type": "string",
      "pattern": "^\\d{4}-\\d{2}-\\d{2}T\\d{2}:\\d{2}(:\\d{2})?[+-]\\d{2}:\\d{2}$"
    },
    "weekend": {
      "type": "object",
      "additionalProperties": false,
      "required": [
        "start",
        "end"
      ],
      "properties": {
        "start": {
          "$ref": "#/$defs/date"
        },
        "end": {
          "$ref": "#/$defs/date"
        }
      }
    },
    "flagship": {
      "$ref": "#/$defs/flagship"
    },
    "local_trail": {
      "$ref": "#/$defs/outing"
    },
    "away_mission": {
      "$ref": "#/$defs/outing"
    },
    "wildcard": {
      "$ref": "#/$defs/outing"
    },
    "mission": {
      "type": "object",
      "additionalProperties": false,
      "required": [
        "text",
        "tone"
      ],
      "properties": {
        "text": {
          "type": "string",
          "minLength": 4
        },
        "tone": {
          "enum": [
            "play",
            "explore",
            "training"
          ]
        }
      }
    },
    "memory_prompt": {
      "type": "object",
      "additionalProperties": false,
      "required": [
        "kind",
        "text"
      ],
      "properties": {
        "kind": {
          "enum": [
            "photo",
            "video",
            "observation",
            "object",
            "note"
          ]
        },
        "text": {
          "type": "string",
          "minLength": 4
        }
      }
    },
    "conditions": {
      "type": "object",
      "additionalProperties": false,
      "required": [
        "summary",
        "as_of"
      ],
      "properties": {
        "summary": {
          "type": "string"
        },
        "as_of": {
          "type": "string"
        },
        "pivot": {
          "type": "object",
          "additionalProperties": false,
          "required": [
            "if",
            "note"
          ],
          "properties": {
            "if": {
              "type": "string"
            },
            "then": {
              "enum": [
                "local_trail",
                "away_mission",
                "wildcard"
              ]
            },
            "note": {
              "type": "string"
            }
          }
        },
        "days": {
          "type": "array",
          "maxItems": 2,
          "items": {
            "type": "object",
            "additionalProperties": false,
            "required": [
              "day",
              "forecast"
            ],
            "properties": {
              "day": {
                "enum": [
                  "Saturday",
                  "Sunday"
                ]
              },
              "forecast": {
                "type": "string",
                "minLength": 1
              }
            }
          }
        },
        "trail_note": {
          "type": "string"
        },
        "kind": {
          "enum": [
            "outlook",
            "forecast",
            "unavailable"
          ]
        },
        "checked_at": {
          "type": "string"
        },
        "source": {
          "type": "object",
          "additionalProperties": false,
          "required": [
            "label",
            "url",
            "issued_at",
            "retrieved_at"
          ],
          "properties": {
            "label": {
              "type": "string"
            },
            "url": {
              "type": "string"
            },
            "issued_at": {
              "type": "string"
            },
            "retrieved_at": {
              "type": "string"
            }
          }
        },
        "unavailable_reason": {
          "type": "string"
        },
        "alerts_checked_at": {
          "type": "string"
        },
        "alerts": {
          "type": "array",
          "items": {
            "type": "object",
            "additionalProperties": false,
            "required": [
              "event",
              "headline",
              "severity",
              "expires"
            ],
            "properties": {
              "event": {
                "type": "string"
              },
              "headline": {
                "type": "string"
              },
              "severity": {
                "type": "string"
              },
              "expires": {
                "type": [
                  "string",
                  "null"
                ]
              }
            }
          }
        }
      }
    },
    "practical": {
      "type": "object",
      "additionalProperties": false,
      "properties": {
        "best_window": {
          "type": "string"
        },
        "fees": {
          "type": "string"
        },
        "bring": {
          "type": "array",
          "items": {
            "type": "string"
          }
        },
        "closures_checked": {
          "type": [
            "string",
            "null"
          ]
        },
        "closures_note": {
          "type": "string"
        }
      }
    },
    "interlude": {
      "type": "object",
      "additionalProperties": false,
      "required": [
        "photo_id"
      ],
      "description": "A full-bleed photograph that breaks the sheet on This Week. Caption defaults to the photo's place and date.",
      "properties": {
        "photo_id": {
          "type": "string"
        },
        "alt": {
          "type": "string"
        },
        "caption": {
          "type": "string"
        }
      }
    },
    "corrections": {
      "type": "array",
      "items": {
        "type": "object",
        "additionalProperties": false,
        "required": [
          "at",
          "note"
        ],
        "properties": {
          "at": {
            "type": "string"
          },
          "field": {
            "type": "string"
          },
          "note": {
            "type": "string"
          }
        }
      }
    }
  },
  "$defs": {
    "date": {
      "type": "string",
      "pattern": "^\\d{4}-\\d{2}-\\d{2}$"
    },
    "photoRef": {
      "type": "object",
      "additionalProperties": false,
      "required": [
        "id",
        "alt"
      ],
      "properties": {
        "id": {
          "type": "string"
        },
        "alt": {
          "type": "string",
          "minLength": 8
        },
        "focal": {
          "type": "array",
          "items": {
            "type": "number",
            "minimum": 0,
            "maximum": 1
          },
          "minItems": 2,
          "maxItems": 2
        }
      }
    },
    "snapshot": {
      "description": "Place and route facts frozen at publication. Never rewritten; later changes go in corrections[].",
      "type": "object",
      "additionalProperties": false,
      "required": [
        "as_of",
        "crowd"
      ],
      "properties": {
        "as_of": {
          "$ref": "#/$defs/date"
        },
        "route": {
          "type": "object",
          "additionalProperties": false,
          "properties": {
            "route_id": {
              "type": "string",
              "pattern": "@\\d+$"
            },
            "distance_mi": {
              "type": "number",
              "minimum": 0
            },
            "shape": {
              "enum": [
                "loop",
                "out and back",
                "point to point",
                "lollipop"
              ]
            },
            "gain_ft": {
              "type": "number"
            },
            "climb_ft_approx": {
              "type": "number"
            },
            "difficulty": {
              "enum": [
                "easy",
                "moderate",
                "strenuous"
              ]
            },
            "surface": {
              "type": "string"
            }
          }
        },
        "access": {
          "type": "object",
          "additionalProperties": false,
          "properties": {
            "name": {
              "type": "string"
            },
            "parking": {
              "type": "string"
            }
          }
        },
        "drive": {
          "type": "object",
          "additionalProperties": false,
          "required": [
            "from",
            "minutes"
          ],
          "properties": {
            "from": {
              "const": "chapel-hill-public"
            },
            "minutes": {
              "type": "array",
              "items": {
                "type": "integer",
                "minimum": 0
              },
              "minItems": 2,
              "maxItems": 2
            }
          }
        },
        "duration_h": {
          "type": "array",
          "items": {
            "type": "number",
            "minimum": 0
          },
          "minItems": 2,
          "maxItems": 2
        },
        "dog": {
          "type": "object",
          "additionalProperties": false,
          "properties": {
            "leash": {
              "type": "string"
            },
            "water": {
              "type": "string"
            },
            "shade": {
              "type": "string"
            },
            "watch_for": {
              "type": "array",
              "items": {
                "type": "string"
              }
            }
          }
        },
        "crowd": {
          "$ref": "#/$defs/crowd"
        }
      }
    },
    "source": {
      "type": "object",
      "additionalProperties": false,
      "required": [
        "kind",
        "label",
        "url",
        "retrieved"
      ],
      "properties": {
        "kind": {
          "enum": [
            "alltrails",
            "park",
            "guide",
            "forecast",
            "visit"
          ]
        },
        "label": {
          "type": "string"
        },
        "url": {
          "type": "string",
          "pattern": "^https://"
        },
        "retrieved": {
          "$ref": "#/$defs/date"
        }
      }
    },
    "flagship": {
      "type": "object",
      "additionalProperties": false,
      "required": [
        "place_id",
        "title",
        "standfirst",
        "why_this_week",
        "snapshot",
        "photo",
        "sources",
        "condition_level",
        "seasons",
        "experiences"
      ],
      "properties": {
        "place_id": {
          "type": "string"
        },
        "title": {
          "type": "string",
          "minLength": 4,
          "maxLength": 80
        },
        "standfirst": {
          "type": "string",
          "maxLength": 220
        },
        "why_this_week": {
          "type": "string"
        },
        "headline_condition": {
          "type": "string",
          "maxLength": 48
        },
        "snapshot": {
          "$ref": "#/$defs/snapshot"
        },
        "photo": {
          "$ref": "#/$defs/photoRef"
        },
        "sources": {
          "type": "array",
          "items": {
            "$ref": "#/$defs/source"
          },
          "minItems": 1
        },
        "condition_level": {
          "enum": [
            "normal",
            "adverse"
          ],
          "description": "adverse = storms, dangerous heat, flooding, closures, ice. Only adverse gets the Field Red warning treatment."
        },
        "seasons": {
          "type": "array",
          "minItems": 1,
          "items": {
            "enum": [
              "spring",
              "summer",
              "autumn",
              "winter"
            ]
          }
        },
        "experiences": {
          "type": "array",
          "minItems": 1,
          "items": {
            "enum": [
              "woodland",
              "river",
              "ridge",
              "short-walk",
              "full-day",
              "swim",
              "town-walk",
              "cafe",
              "patio",
              "brewery",
              "pup-treat",
              "market",
              "shopping",
              "garden",
              "campus",
              "scenic-drive",
              "ferry",
              "picnic",
              "event"
            ]
          }
        },
        "artwork": {
          "$ref": "#/$defs/artwork"
        },
        "panels": {
          "$ref": "#/$defs/panels"
        },
        "qualities": {
          "$ref": "#/$defs/qualities"
        },
        "experience_id": {
          "type": "string",
          "pattern": "^[a-z0-9-]{3,100}$"
        },
        "difference_note": {
          "type": "string",
          "minLength": 20,
          "maxLength": 500,
          "description": "Editorial evidence of a materially different route, event or seasonal experience; a rewrite is insufficient."
        },
        "event_window": {
          "type": "object",
          "additionalProperties": false,
          "required": [
            "start",
            "end"
          ],
          "properties": {
            "start": {
              "$ref": "#/$defs/date"
            },
            "end": {
              "$ref": "#/$defs/date"
            }
          }
        }
      }
    },
    "outing": {
      "type": "object",
      "additionalProperties": false,
      "required": [
        "place_id",
        "title",
        "line",
        "snapshot",
        "seasons",
        "experiences"
      ],
      "properties": {
        "place_id": {
          "type": "string"
        },
        "title": {
          "type": "string",
          "maxLength": 70
        },
        "line": {
          "type": "string",
          "maxLength": 200
        },
        "commitment": {
          "type": "string"
        },
        "snapshot": {
          "$ref": "#/$defs/snapshot"
        },
        "seasons": {
          "type": "array",
          "minItems": 1,
          "items": {
            "enum": [
              "spring",
              "summer",
              "autumn",
              "winter"
            ]
          }
        },
        "experiences": {
          "type": "array",
          "minItems": 1,
          "items": {
            "enum": [
              "woodland",
              "river",
              "ridge",
              "short-walk",
              "full-day",
              "swim",
              "town-walk",
              "cafe",
              "patio",
              "brewery",
              "pup-treat",
              "market",
              "shopping",
              "garden",
              "campus",
              "scenic-drive",
              "ferry",
              "picnic",
              "event"
            ]
          }
        }
      }
    },
    "crowd": {
      "description": "Core outing metadata. Null means not assessed, never Low. Levels describe typical presence and perceived crowding independently; attendance may describe observed headcounts or qualitative presence. Freeze at publication.",
      "type": "object",
      "additionalProperties": false,
      "required": [
        "typical_level",
        "low_crowd_window",
        "peak_period",
        "weekend_vs_weekday",
        "foot_traffic",
        "dog_density",
        "attendance",
        "perceived_crowding"
      ],
      "properties": {
        "typical_level": {
          "enum": [
            "Low",
            "Moderate",
            "Busy",
            "Very Busy",
            null
          ]
        },
        "low_crowd_window": {
          "type": [
            "string",
            "null"
          ],
          "minLength": 1
        },
        "peak_period": {
          "type": [
            "string",
            "null"
          ],
          "minLength": 1
        },
        "weekend_vs_weekday": {
          "type": [
            "string",
            "null"
          ],
          "minLength": 1
        },
        "foot_traffic": {
          "type": [
            "string",
            "null"
          ],
          "minLength": 1
        },
        "dog_density": {
          "type": [
            "string",
            "null"
          ],
          "minLength": 1
        },
        "attendance": {
          "type": [
            "string",
            "null"
          ],
          "minLength": 1
        },
        "perceived_crowding": {
          "enum": [
            "Low",
            "Moderate",
            "Busy",
            "Very Busy",
            null
          ]
        }
      }
    },
    "artwork": {
      "type": "object",
      "additionalProperties": false,
      "required": [
        "image_id",
        "brief",
        "characters"
      ],
      "properties": {
        "image_id": {
          "type": "string",
          "pattern": "^[a-z0-9-]+$"
        },
        "brief": {
          "type": "string",
          "minLength": 20,
          "maxLength": 1000
        },
        "characters": {
          "type": "array",
          "minItems": 1,
          "maxItems": 3,
          "items": {
            "enum": [
              "rupert",
              "bosch",
              "tilli"
            ]
          }
        }
      }
    },
    "panels": {
      "type": "array",
      "minItems": 2,
      "maxItems": 2,
      "items": {
        "type": "object",
        "additionalProperties": false,
        "required": [
          "label",
          "text"
        ],
        "properties": {
          "label": {
            "type": "string",
            "minLength": 2,
            "maxLength": 40
          },
          "text": {
            "type": "string",
            "minLength": 10,
            "maxLength": 350
          }
        }
      }
    },
    "qualities": {
      "type": "object",
      "additionalProperties": false,
      "properties": {
        "activity": {
          "enum": [
            "hike",
            "swim",
            "town",
            "patio",
            "pup-cup",
            "road-trip"
          ]
        },
        "expected_heat": {
          "enum": [
            "hot",
            "normal",
            "cold",
            "unknown"
          ]
        }
      }
    }
  }
}
